{
  "horizon": 28,
  "shifts": [
    {
      "shift_id": "LM",
      "length": 480,
      "cannot_follow": [],
      "stress_weight": 1
    },
    {
      "shift_id": "LA",
      "length": 480,
      "cannot_follow": [
        "LM"
      ],
      "stress_weight": 2
    },
    {
      "shift_id": "LN",
      "length": 480,
      "cannot_follow": [
        "LM",
        "LA"
      ],
      "stress_weight": 3
    },
    {
      "shift_id": "RM",
      "length": 480,
      "cannot_follow": [],
      "stress_weight": 1
    },
    {
      "shift_id": "RA",
      "length": 480,
      "cannot_follow": [
        "RM"
      ],
      "stress_weight": 2
    },
    {
      "shift_id": "RN",
      "length": 480,
      "cannot_follow": [
        "RM",
        "RA"
      ],
      "stress_weight": 3
    },
    {
      "shift_id": "AM",
      "length": 480,
      "cannot_follow": [],
      "stress_weight": 1
    },
    {
      "shift_id": "AA",
      "length": 480,
      "cannot_follow": [
        "AM"
      ],
      "stress_weight": 2
    },
    {
      "shift_id": "AN",
      "length": 480,
      "cannot_follow": [
        "AM",
        "AA"
      ],
      "stress_weight": 3
    }
  ],
  "staff": [
    {
      "employee_id": "Rachel",
      "max_shifts": [
        {
          "shift_id": "LM",
          "max_shifts": 12
        },
        {
          "shift_id": "LA",
          "max_shifts": 12
        },
        {
          "shift_id": "LN",
          "max_shifts": 12
        }
      ],
      "max_total_minutes": 5760,
      "min_total_minutes": 5760,
      "max_weekly_minutes": 1440,
      "min_weekly_minutes": 1440,
      "max_consecutive_shifts": 10,
      "min_consecutive_shifts": 1,
      "min_consecutive_days_off": 1,
      "max_weekends": 4,
      "stress_level": 1
    },
    {
      "employee_id": "Kyle",
      "max_shifts": [
        {
          "shift_id": "LM",
          "max_shifts": 12
        },
        {
          "shift_id": "LA",
          "max_shifts": 12
        },
        {
          "shift_id": "LN",
          "max_shifts": 12
        }
      ],
      "max_total_minutes": 5760,
      "min_total_minutes": 5760,
      "max_weekly_minutes": 1440,
      "min_weekly_minutes": 1440,
      "max_consecutive_shifts": 10,
      "min_consecutive_shifts": 1,
      "min_consecutive_days_off": 1,
      "max_weekends": 4,
      "stress_level": 1
    },
    {
      "employee_id": "Jessica",
      "max_shifts": [
        {
          "shift_id": "LM",
          "max_shifts": 20
        },
        {
          "shift_id": "LA",
          "max_shifts": 20
        },
        {
          "shift_id": "LN",
          "max_shifts": 20
        }
      ],
      "max_total_minutes": 9600,
      "min_total_minutes": 9600,
      "max_weekly_minutes": 2400,
      "min_weekly_minutes": 2400,
      "max_consecutive_shifts": 10,
      "min_consecutive_shifts": 1,
      "min_consecutive_days_off": 1,
      "max_weekends": 4,
      "stress_level": 1
    },
    {
      "employee_id": "Gabriella",
      "max_shifts": [
        {
          "shift_id": "LM",
          "max_shifts": 20
        },
        {
          "shift_id": "LA",
          "max_shifts": 20
        },
        {
          "shift_id": "LN",
          "max_shifts": 20
        }
      ],
      "max_total_minutes": 9600,
      "min_total_minutes": 9600,
      "max_weekly_minutes": 2400,
      "min_weekly_minutes": 2400,
      "max_consecutive_shifts": 10,
      "min_consecutive_shifts": 1,
      "min_consecutive_days_off": 1,
      "max_weekends": 4,
      "stress_level": 1
    },
    {
      "employee_id": "Craig",
      "max_shifts": [
        {
          "shift_id": "LM",
          "max_shifts": 20
        },
        {
          "shift_id": "LA",
          "max_shifts": 20
        },
        {
          "shift_id": "LN",
          "max_shifts": 20
        }
      ],
      "max_total_minutes": 9600,
      "min_total_minutes": 9600,
      "max_weekly_minutes": 2400,
      "min_weekly_minutes": 2400,
      "max_consecutive_shifts": 10,
      "min_consecutive_shifts": 1,
      "min_consecutive_days_off": 1,
      "max_weekends": 4,
      "stress_level": 1
    },
    {
      "employee_id": "Ryan",
      "max_shifts": [
        {
          "shift_id": "RM",
          "max_shifts": 20
        },
        {
          "shift_id": "RA",
          "max_shifts": 20
        },
        {
          "shift_id": "RN",
          "max_shifts": 20
        }
      ],
      "max_total_minutes": 9600,
      "min_total_minutes": 9600,
      "max_weekly_minutes": 2400,
      "min_weekly_minutes": 2400,
      "max_consecutive_shifts": 10,
      "min_consecutive_shifts": 1,
      "min_consecutive_days_off": 1,
      "max_weekends": 4,
      "stress_level": 1
    },
    {
      "employee_id": "Cheryl",
      "max_shifts": [
        {
          "shift_id": "RM",
          "max_shifts": 20
        },
        {
          "shift_id": "RA",
          "max_shifts": 20
        },
        {
          "shift_id": "RN",
          "max_shifts": 20
        }
      ],
      "max_total_minutes": 9600,
      "min_total_minutes": 9600,
      "max_weekly_minutes": 2400,
      "min_weekly_minutes": 2400,
      "max_consecutive_shifts": 10,
      "min_consecutive_shifts": 1,
      "min_consecutive_days_off": 1,
      "max_weekends": 4,
      "stress_level": 1
    },
    {
      "employee_id": "Robin",
      "max_shifts": [
        {
          "shift_id": "RM",
          "max_shifts": 16
        },
        {
          "shift_id": "RA",
          "max_shifts": 16
        },
        {
          "shift_id": "RN",
          "max_shifts": 16
        }
      ],
      "max_total_minutes": 7680,
      "min_total_minutes": 7680,
      "max_weekly_minutes": 1920,
      "min_weekly_minutes": 1920,
      "max_consecutive_shifts": 10,
      "min_consecutive_shifts": 1,
      "min_consecutive_days_off": 1,
      "max_weekends": 4,
      "stress_level": 1
    },
    {
      "employee_id": "Tammy",
      "max_shifts": [
        {
          "shift_id": "RM",
          "max_shifts": 20
        },
        {
          "shift_id": "RA",
          "max_shifts": 20
        },
        {
          "shift_id": "RN",
          "max_shifts": 20
        }
      ],
      "max_total_minutes": 9600,
      "min_total_minutes": 9600,
      "max_weekly_minutes": 2400,
      "min_weekly_minutes": 2400,
      "max_consecutive_shifts": 10,
      "min_consecutive_shifts": 1,
      "min_consecutive_days_off": 1,
      "max_weekends": 4,
      "stress_level": 1
    },
    {
      "employee_id": "Michelle",
      "max_shifts": [
        {
          "shift_id": "AM",
          "max_shifts": 12
        },
        {
          "shift_id": "AA",
          "max_shifts": 12
        },
        {
          "shift_id": "AN",
          "max_shifts": 12
        }
      ],
      "max_total_minutes": 5760,
      "min_total_minutes": 5760,
      "max_weekly_minutes": 1440,
      "min_weekly_minutes": 1440,
      "max_consecutive_shifts": 10,
      "min_consecutive_shifts": 1,
      "min_consecutive_days_off": 1,
      "max_weekends": 4,
      "stress_level": 1
    },
    {
      "employee_id": "Jorge",
      "max_shifts": [
        {
          "shift_id": "AM",
          "max_shifts": 20
        },
        {
          "shift_id": "AA",
          "max_shifts": 20
        },
        {
          "shift_id": "AN",
          "max_shifts": 20
        }
      ],
      "max_total_minutes": 9600,
      "min_total_minutes": 9600,
      "max_weekly_minutes": 2400,
      "min_weekly_minutes": 2400,
      "max_consecutive_shifts": 10,
      "min_consecutive_shifts": 1,
      "min_consecutive_days_off": 1,
      "max_weekends": 4,
      "stress_level": 1
    },
    {
      "employee_id": "Linda",
      "max_shifts": [
        {
          "shift_id": "AM",
          "max_shifts": 20
        },
        {
          "shift_id": "AA",
          "max_shifts": 20
        },
        {
          "shift_id": "AN",
          "max_shifts": 20
        }
      ],
      "max_total_minutes": 9600,
      "min_total_minutes": 9600,
      "max_weekly_minutes": 2400,
      "min_weekly_minutes": 2400,
      "max_consecutive_shifts": 10,
      "min_consecutive_shifts": 1,
      "min_consecutive_days_off": 1,
      "max_weekends": 4,
      "stress_level": 1
    },
    {
      "employee_id": "Ana",
      "max_shifts": [
        {
          "shift_id": "AM",
          "max_shifts": 16
        },
        {
          "shift_id": "AA",
          "max_shifts": 16
        },
        {
          "shift_id": "AN",
          "max_shifts": 16
        }
      ],
      "max_total_minutes": 7680,
      "min_total_minutes": 7680,
      "max_weekly_minutes": 1920,
      "min_weekly_minutes": 1920,
      "max_consecutive_shifts": 10,
      "min_consecutive_shifts": 1,
      "min_consecutive_days_off": 1,
      "max_weekends": 4,
      "stress_level": 1
    },
    {
      "employee_id": "Alexis",
      "max_shifts": [
        {
          "shift_id": "AM",
          "max_shifts": 20
        },
        {
          "shift_id": "AA",
          "max_shifts": 20
        },
        {
          "shift_id": "AN",
          "max_shifts": 20
        }
      ],
      "max_total_minutes": 9600,
      "min_total_minutes": 9600,
      "max_weekly_minutes": 2400,
      "min_weekly_minutes": 2400,
      "max_consecutive_shifts": 10,
      "min_consecutive_shifts": 1,
      "min_consecutive_days_off": 1,
      "max_weekends": 4,
      "stress_level": 1
    },
    {
      "employee_id": "Jennifer",
      "max_shifts": [
        {
          "shift_id": "AM",
          "max_shifts": 16
        },
        {
          "shift_id": "AA",
          "max_shifts": 16
        },
        {
          "shift_id": "AN",
          "max_shifts": 16
        }
      ],
      "max_total_minutes": 7680,
      "min_total_minutes": 7680,
      "max_weekly_minutes": 1920,
      "min_weekly_minutes": 1920,
      "max_consecutive_shifts": 10,
      "min_consecutive_shifts": 1,